medicine_id,category_id,name,brand,unit,description,created_at
1,10,Fantastic Bamboo Mouse,Feil - Kassulke,vial,Totus accendo cuius.,2026-01-15 14:19:42
2,6,Fantastic Gold Salad,Price - Pfannerstill,tablet,Pauci eaque velum ago adeo summopere.,2025-10-04 14:29:37
3,5,Rustic Concrete Ball,Dooley - Farrell,vial,Alias labore cavus patior calcar.,2025-12-03 12:30:18
4,3,Frozen Steel Fish,"Lubowitz, Boyer and Bednar",box,Aestus damnatio cogo tracto alias laboriosam.,2025-01-20 21:51:47
5,5,Fantastic Aluminum Pizza,Koch Inc,box,Vilis vinco vigilo delectus sufficio una alter clarus.,2025-02-17 20:48:36
6,9,Small Marble Bike,Paucek - Turner,tablet,Tardus traho subvenio calculus.,2025-03-10 23:30:33
7,7,Unbranded Granite Gloves,Satterfield - Stamm,box,Taedium vos tripudio tergeo depraedor et contra apostolus.,2025-12-31 09:45:52
8,1,Bespoke Ceramic Mouse,Nader LLC,tablet,Accusamus apparatus atqui vorax tonsor termes.,2025-10-27 18:28:27
9,4,Fresh Bronze Chips,"Bode, Kris and Zieme",bottle,Delego dedecor fugiat despecto uterque confido.,2025-07-31 14:29:43
10,8,Sleek Cotton Cheese,Stokes - Turcotte,box,Clementia communis volubilis solus stella.,2025-10-31 04:45:16
11,5,Bespoke Bamboo Keyboard,Kilback - Shanahan,averto,Coaegresco suasoria pauci vorax cupressus conatus.,2025-11-20 05:42:23
12,7,Awesome Wooden Towels,Collier - Wilkinson,tablet,Trans similique necessitatibus.,2025-06-12 06:55:42
13,8,Handcrafted Aluminum Fish,"Brekke, Buckridge and Hermann",vial,Cogito caecus sonitus succedo clibanus auctor ventosus deludo compello congregatio.,2025-12-10 04:22:49
14,6,Practical Steel Shoes,Gleichner - Witting,bottle,Veniam apparatus vix fuga calco enim ulterius iste cilicium.,2025-01-23 09:48:06
15,2,Ergonomic Aluminum Mouse,Schuster - Kovacek,box,Speculum minima odio ullus suasoria.,2025-04-28 05:41:20
16,6,Intelligent Cotton Ball,"MacGyver, Satterfield and Thiel",vial,Trans sui voluptatibus adeo amicitia.,2025-10-26 20:41:17
17,5,Refined Rubber Shirt,"Daniel, Shields and Heaney",bottle,Solus autem apto ipsa patior.,2025-03-26 21:10:31
18,6,Handcrafted Cotton Tuna,"Koepp, Spinka and Mraz",box,Aegrotatio canis turbo deprecator aqua delectus denique ago.,2025-12-10 08:57:15
19,8,Practical Rubber Sausages,Satterfield - Grady,bottle,Contego pecto consequatur vinculum torqueo asperiores fugiat umbra custodia super.,2025-11-21 14:47:39
20,3,Incredible Marble Fish,Lockman Inc,vial,Coniuratio vere deleniti tibi caritas eius aperio viduo angustus demitto.,2025-06-13 22:52:20
21,2,Licensed Wooden Table,"Ferry, Kub and Konopelski",bottle,Arguo caritas tener subseco dolore traho torrens comparo.,2025-03-14 13:02:04
22,2,Handcrafted Metal Tuna,Thompson Group,tablet,Solium undique statim cornu addo dolorum.,2025-08-28 03:04:38
23,8,Unbranded Plastic Pizza,Smitham Inc,tablet,Deporto adulatio officia sumptus tantillus et vivo ara totidem adimpleo.,2025-05-07 11:52:30
24,4,Modern Gold Ball,Romaguera Inc,box,Vinculum itaque decet conatus teneo ab amplitudo abundans.,2025-08-15 00:56:13
25,7,Electronic Granite Keyboard,"Littel, Jones and Kertzmann",vial,Compello maiores vestigium curo.,2025-11-17 17:30:19
26,9,Ergonomic Bamboo Tuna,Jacobi Group,box,Decens cubicularis cresco currus corrupti.,2026-01-14 15:34:17
27,5,Elegant Bronze Ball,King and Sons,tablet,Canonicus ab certe dapifer decretum adhuc.,2025-05-19 19:25:09
28,4,Electronic Wooden Ball,Corwin - Bosco,vial,Sonitus stipes absum tibi.,2025-06-24 03:50:31
29,5,Tasty Cotton Keyboard,Armstrong - Schulist,box,Acies corpus clamo teneo delectatio adsum usus tergiversatio.,2025-04-19 20:32:53
30,7,,Murphy LLC,bottle,Pax turpis patrocinor placeat timor tempus ater valeo vitium abduco.,2025-12-19 09:35:23
31,8,Practical Bronze Table,Huels LLC,tablet,Nam cuppedia umquam.,2025-10-19 05:50:56
32,6,Licensed Silk Pants,Satterfield Group,tablet,Aperio ullam culpa valens venia in pariatur comprehendo.,2025-03-11 12:50:37
33,8,Practical Marble Cheese,"Feil, Lebsack and Leuschke",tablet,Sonitus valeo atavus uter vis communis taedium dignissimos usque apto.,2025-05-09 14:07:40
34,4,Incredible Silk Chicken,"Feeney, Wiegand and Schimmel",bottle,Aestus adimpleo agnitio desolo clarus repellendus una audentia.,2025-07-18 01:04:40
35,2,Refined Silk Hat,Adams - Dooley,vial,Valens atrocitas curatio maxime absque conforto tero conspergo.,2025-11-27 13:26:38
36,2,Recycled Wooden Pants,"Larkin, Carter and Senger",bottle,Eos vae vulgo cotidie bene.,2025-01-21 14:07:59
37,9,Incredible Steel Tuna,Greenholt - Lynch,tablet,Amissio creber nesciunt non ago confido paulatim vicinus tantillus.,2025-12-27 01:55:23
38,9,Rustic Concrete Ball,Hettinger - Collier,tablet,Adulescens triumphus pauci calculus curriculum suspendo vitiosus depono decretum deorsum.,2025-02-13 13:35:35
39,2,Modern Metal Soap,Murray - Rogahn,tablet,Ullus verus amita.,2025-12-24 13:04:04
40,3,Rustic Silk Computer,Hoeger - Bernier,tablet,Reiciendis inflammatio vilitas placeat sonitus vitiosus vorax calco calco sono.,2025-06-04 14:55:18
41,8,Luxurious Ceramic Computer,Muller and Sons,vial,Triumphus umquam auditor virtus arbor.,2025-08-30 20:02:35
42,10,Handcrafted Steel Tuna,Keeling - Hermiston,vial,Termes vinum eius modi urbs cornu.,2025-12-14 05:05:52
43,9,Handcrafted Plastic Car,Ryan Inc,vial,Sub neque asperiores.,2025-06-17 03:09:28
44,6,Modern Plastic Car,Konopelski Group,vial,Volaticus taedium teneo audax.,2025-08-05 05:49:06
45,2,Generic Cotton Mouse,Corwin Inc,tablet,Verumtamen aestas desidero deprecator voluptate ait cunabula viriliter.,2025-06-30 07:05:45
46,7,Soft Bronze Hat,Durgan - Gerhold,vial,Amet conqueror eius adipiscor odio tui alo cunctatio auxilium aveho.,2025-01-24 04:10:49
47,5,Bespoke Gold Soap,Prohaska - Daniel,tablet,Anser apud cognatus sunt stips viscus convoco eaque.,2025-06-13 00:31:35
48,9,Awesome Bamboo Computer,"Padberg, Boehm and Carroll",box,Facere candidus vobis tredecim deprecator accendo ullam curis sto.,2025-10-09 07:01:19
49,2,Small Wooden Fish,Heller and Sons,vial,Cornu auditor conturbo allatus.,2025-08-03 04:58:42
50,6,Modern Bamboo Sausages,Gulgowski - Hane,tablet,Repellendus desparatus stella voco repellat totus amitto.,2025-01-22 09:38:18
51,7,Handmade Gold Chair,Bednar - O'Connell,tablet,Provident deludo sophismata ocer vilicus desparatus quisquam odio.,2025-10-18 13:19:11
52,8,Incredible Ceramic Bike,Gislason - Moore,vial,Super rerum curo vestigium.,2025-12-17 05:41:40
53,8,Tasty Rubber Car,Lesch Group,tablet,Caelestis appono arca denuo conduco vulgaris.,2025-06-15 03:03:35
54,10,Fresh Marble Pizza,"Rohan, Spencer and Franecki",bottle,Odio cibus capio admoneo.,2025-10-02 14:57:11
55,6,Handcrafted Bamboo Hat,"Ziemann, Grimes and Herman",vial,Commodo molestiae auditor.,2025-11-03 22:59:04
56,2,Unbranded Aluminum Gloves,Hintz - West,box,Strues textus volup.,2025-07-29 09:08:56
57,6,Incredible Wooden Cheese,"McLaughlin, Kshlerin and Boehm",vial,Alius supplanto umquam adeptio.,2025-12-14 04:19:42
58,3,Intelligent Aluminum Pants,Green - Miller,vial,Venustas triumphus vinco viscus deleniti tandem incidunt curia umquam verbera.,2025-07-10 20:09:45
59,7,Fresh Concrete Chips,"Williamson, Leuschke and Murazik",tablet,Supellex aeger porro antea.,2025-12-01 00:43:07
60,6,Awesome Rubber Towels,"Weber, Williamson and Cartwright",tablet,Carpo thorax usitas.,2025-07-22 16:04:45
61,2,Fantastic Granite Shoes,"Runolfsdottir, Turner and Rempel",box,Textor ceno amissio cinis sulum numquam error somnus peccatus spiculum.,2026-01-11 07:13:00
62,4,Refined Plastic Car,Heathcote and Sons,tablet,Cogo vapulus studio administratio degenero absconditus debeo ipsam alioqui demitto.,2025-11-17 12:04:23
63,2,Rustic Aluminum Soap,"Prosacco, Marvin and Murray",box,Addo agnitio volaticus corroboro umbra arma aestas.,2025-03-09 18:22:03
64,5,Practical Bronze Ball,"Hand, Hoeger and Marks",vial,Sapiente vitae absconditus bestia teneo arguo delinquo succurro qui delectatio.,2025-11-20 21:13:17
65,6,,"Thompson, Jacobson and Hane",censura,Amaritudo deleo spero tego artificiose argumentum sumo.,2025-02-14 21:06:27
66,8,Tasty Rubber Bacon,Klein - Harber,bottle,Stella utroque aliquam vinculum comitatus atrocitas vesper tantum.,2025-02-07 22:40:08
67,8,Tasty Marble Keyboard,"Goyette, Lockman and Senger",tablet,Delicate vita cohors valde suffoco.,2025-12-21 04:56:15
68,10,Small Marble Hat,Goldner - Lesch,bottle,Cauda apud adficio cauda at ocer officia.,2025-05-07 00:21:34
69,8,Electronic Steel Chips,"Kerluke, Kertzmann and Herman",bottle,Demum ago turpis praesentium volaticus censura.,2025-12-12 23:03:24
70,2,Oriental Ceramic Tuna,"Spencer, Sipes and Parisian",box,Celebrer cattus tripudio armarium vulgus quibusdam conatus.,2025-03-14 08:30:01
71,3,Licensed Metal Ball,Gusikowski Group,tablet,Solus aperio incidunt tamdiu pax.,2025-08-20 04:25:15
72,9,Ergonomic Concrete Shoes,Ebert - Champlin,box,Cattus conor debitis voluptatum caries veniam vorago teneo amet.,2025-08-30 03:15:24
73,4,Frozen Marble Sausages,Connelly - Beahan,vial,Adsuesco spes bene triduana.,2025-10-12 17:12:48
74,8,Recycled Bronze Ball,Ullrich LLC,vial,Tripudio vacuus videlicet sui.,2025-09-07 07:17:33
75,9,Fantastic Bronze Chair,Will LLC,box,Cupressus voveo delibero admitto decens.,2025-08-10 07:26:16
76,7,Handmade Ceramic Bacon,"Balistreri, Swift and Schaefer",bottle,Arcus maiores amet confero.,2026-01-07 05:37:11
77,7,Unbranded Granite Chips,Daugherty - Kessler,bottle,Cohibeo patruus libero complectus.,2025-11-29 22:58:54
78,7,Oriental Marble Computer,Lockman - Watsica,box,Repudiandae error xiphias alius arbor confido.,2025-09-27 15:36:56
79,1,Generic Cotton Car,Dooley - Denesik,vulgo,Denique tenax vacuus defessus nemo clam dignissimos.,2025-07-16 18:35:33
80,4,Awesome Wooden Car,"Stracke, Effertz and Connelly",vial,Baiulus demonstro degenero quibusdam.,2025-03-23 10:38:41
81,2,Tasty Plastic Car,Runolfsson Inc,bottle,Demum cunabula corpus decipio degero condico.,2025-02-01 13:10:37
82,2,Luxurious Cotton Tuna,Lind Group,box,Deporto caute surculus velut crebro suasoria.,2025-11-16 06:40:56
83,5,Rustic Cotton Tuna,Kuhic and Sons,box,Allatus vinculum bonus necessitatibus apparatus demo suppellex vereor.,2025-10-24 13:47:03
84,2,Luxurious Granite Car,Fisher and Sons,tablet,Conforto depono torqueo arcus comitatus tempora animus spiculum spectaculum terror.,2025-06-22 05:17:38
85,4,Gorgeous Aluminum Ball,"Waelchi, Metz and Hudson",box,Carus stipes arma.,2025-03-09 03:07:28
86,8,Sleek Metal Car,Jones LLC,vial,Speciosus sortitus eum crur demergo suus toties.,2025-09-07 06:49:27
87,4,Electronic Gold Chair,"Block, Rosenbaum and Schoen",tablet,Perspiciatis caelum derideo cruciamentum beneficium iste coadunatio vis.,2025-12-17 20:28:52
88,7,Luxurious Cotton Chips,"Fahey, Howe and Smitham",vial,Desolo calcar adficio tot temptatio complectus aperiam argumentum corrigo tristis.,2025-08-05 15:56:29
89,5,Fantastic Bronze Mouse,"Gerlach, Kassulke and Nienow",tablet,Vulgaris aliquid coniecto odio animi pel absens esse.,2025-10-30 18:01:31
90,9,Modern Granite Towels,Grant and Sons,box,Supellex eos viduo tripudio impedit abstergo adipisci.,2025-05-10 12:01:13
91,9,Awesome Steel Keyboard,Cole and Sons,vial,Desipio comitatus textilis voluptas decerno consuasor inflammatio sodalitas.,2025-10-08 02:46:27
92,10,Gorgeous Wooden Salad,"Cruickshank, Hills and McClure",bottle,Bibo adulescens corporis tonsor provident sollicito aliquam contigo administratio quos.,2025-03-17 15:39:44
93,7,Refined Marble Keyboard,Mueller - Connelly,bottle,Derideo aveho volubilis vicissitudo debeo votum decor perferendis tenus terra.,2025-11-26 14:41:16
94,8,Electronic Rubber Table,"Metz, Hilpert and Mueller",box,Aperte vicinus casus accusamus demitto conscendo universe blandior.,2025-05-11 06:26:45
95,5,Generic Granite Hat,Crooks - Ortiz,box,Dolores sublime uredo.,2025-11-02 04:11:01
96,6,Small Plastic Towels,"Zulauf, Stokes and Smitham",vial,Accendo defetiscor conforto confido vel artificiose suffragium conduco.,2025-04-28 17:39:19
97,8,Refined Aluminum Mouse,"Leffler, Schowalter and Russel",bottle,Doloremque truculenter officiis in curso acsi.,2025-10-07 11:25:49
98,8,Licensed Granite Shirt,Vandervort - Schamberger,vial,Thorax arcesso cometes antiquus autus commodo tergum textus tepidus accusamus.,2025-08-19 10:40:20
99,1,Tasty Bronze Soap,"Krajcik, Wilkinson and Mitchell",box,Vinculum alius acer similique architecto conventus totam adstringo.,2025-11-25 10:06:13
100,1,Handcrafted Marble Bike,Bradtke Inc,vial,Vulariter utrimque sonitus cubo velut aiunt conservo.,2025-02-07 06:12:27
101,2,Intelligent Cotton Bacon,Treutel - Schuppe,vial,Minus pauper vergo provident conventus dolorum crebro curia.,2025-04-01 15:52:48
102,5,Licensed Gold Hat,"Herman, Carroll and Gorczany",box,Uxor tendo bestia cohibeo.,2025-11-25 22:16:51
103,5,Small Marble Pizza,Ryan Group,tablet,Audentia creo vobis crebro magni tego.,2025-01-31 01:53:04
104,2,Incredible Rubber Salad,"Koss, Rohan and Renner",bottle,Studio non eveniet colligo caries.,2025-07-12 07:32:51
105,10,Small Bamboo Table,Zieme Inc,vial,Usitas uterque tui cenaculum curis tredecim beneficium.,2025-07-22 03:00:32
106,6,Unbranded Rubber Fish,Conn Inc,vial,Quidem abeo accusantium denego voro via amplexus accendo admitto suus.,2025-10-18 23:35:04
107,2,Generic Concrete Keyboard,Ledner - Schmeler,vial,Concido eligendi apto apparatus.,2025-07-22 00:58:21
108,4,Intelligent Gold Soap,Shanahan - Casper,tablet,Patrocinor delectatio votum.,2026-01-07 12:29:24
109,6,Refined Ceramic Computer,"Abbott, Willms and Jakubowski",bottle,Alo demo dedecor deserunt cuius videlicet dolor veritatis maiores.,2025-05-30 16:38:13
110,9,Licensed Aluminum Tuna,Lowe - Breitenberg,tablet,Cito canonicus voluntarius.,2025-04-11 22:30:54
111,5,Ergonomic Concrete Table,"Hermiston, Collins and Dooley",box,Bos tabesco absorbeo accommodo terminatio possimus credo.,2025-11-25 17:27:49
112,3,Awesome Gold Chair,"Gusikowski, Schamberger and Effertz",bottle,Caveo expedita supplanto validus animi aufero.,2025-03-11 16:25:27
113,7,Modern Wooden Table,Zieme Inc,box,Attonbitus virgo caterva demum curvo.,2025-12-25 12:42:12
114,3,Incredible Cotton Fish,Kuphal Group,tablet,Tres villa terror villa volutabrum arguo damnatio tandem calcar.,2026-01-08 04:07:01
115,10,Oriental Metal Sausages,"Beier, Hahn and Bechtelar",tablet,Ars decerno curto tenetur non.,2025-10-20 22:51:06
116,10,Luxurious Metal Ball,Bode LLC,vial,Denuo labore villa appositus audax sui condico blanditiis deinde.,2025-06-02 09:47:36
117,9,Licensed Bronze Salad,Kub - Champlin,tablet,Super sto tergum adnuo.,2025-11-23 18:55:22
118,5,Elegant Marble Pants,"King, Schowalter and Fay",bottle,Summa terminatio quas dolores degusto tumultus tunc voro.,2025-09-29 19:43:11
119,7,Elegant Steel Towels,Ward - Pfannerstill,tablet,Cornu vespillo conventus vinitor animus aurum fugiat recusandae clam.,2025-05-24 23:58:02
120,4,Rustic Metal Bacon,"Stroman, Zemlak and Renner",vial,Dedico iusto temperantia demum itaque ultra molestias curso.,2025-05-06 22:22:27
121,2,Rustic Wooden Chicken,"Kuhlman, Balistreri and Simonis",bottle,Strenuus ago tabernus convoco torrens absorbeo.,2025-04-13 07:55:43
122,1,Generic Steel Sausages,Towne and Sons,bottle,Ex ratione demulceo vinum audacia vulariter demum verumtamen officia.,2025-11-21 09:36:06
123,1,Fresh Rubber Car,Veum Group,box,Thymbra trepide considero aperio victoria absorbeo summisse.,2025-03-16 17:10:09
124,2,Practical Bamboo Ball,"Mante, Gislason and Brakus",bottle,Congregatio recusandae custodia deleniti crebro video solio pauci campana arguo.,2025-10-25 18:53:51
125,8,Intelligent Steel Table,Fay LLC,tablet,Conspergo thema ars dedecor demonstro delectatio correptius aiunt necessitatibus.,2025-10-16 04:50:44
126,10,Ergonomic Silk Shoes,Walter Inc,vial,Doloribus ager ipsam.,2025-09-13 15:30:08
127,5,Recycled Metal Chips,Paucek - Murphy,vial,Vulgaris nemo carpo vinco adeptio.,2025-11-21 12:27:16
128,4,Generic Rubber Tuna,Willms - Wiegand,tablet,Defendo pax suppellex angustus.,2025-10-03 15:54:52
129,8,Incredible Aluminum Chair,Toy Inc,box,Cinis aptus depopulo quo carus.,2026-01-18 12:15:53
130,4,Practical Bamboo Pants,Daugherty - DuBuque,box,Abduco maxime trans.,2025-05-14 16:18:55
131,5,Small Aluminum Bike,Larson Inc,tablet,Repellat venustas vilitas speculum quasi careo debilito depromo amet coniecto.,2025-07-14 13:51:43
132,1,Soft Silk Chips,Marvin - Little,box,Suadeo amo spoliatio succedo tergo vitiosus.,2025-05-13 15:59:05
133,9,Luxurious Marble Bike,"Torp, Hagenes and Kling",bottle,Denuo causa cunabula depromo alias via argumentum.,2025-12-03 23:29:26
134,8,Tasty Rubber Soap,Jones - Rippin,tablet,Adeo cupressus voluptas corrigo sol rem nostrum.,2025-12-30 08:20:43
135,1,Recycled Bronze Shoes,Monahan Group,tablet,Vicissitudo cilicium nostrum curvo.,2025-05-02 16:02:27
136,3,Small Bronze Chips,"Lind, Herman and Terry",bottle,Fuga tandem vulariter.,2025-01-21 18:02:43
137,7,Handcrafted Granite Cheese,"Douglas, Jacobi and Treutel",tablet,Adsuesco contego enim vero clibanus nam umerus.,2025-08-30 09:11:16
138,9,Small Ceramic Gloves,"Swift, Reilly and Collins",vial,Tamen cura deporto voluptatum totidem sed sunt comburo facere circumvenio.,2026-01-17 11:03:15
139,2,Sleek Ceramic Shoes,Hermann and Sons,bottle,Tantillus suadeo depopulo vinum nobis universe verto dolorem.,2025-05-29 20:15:21
140,8,Frozen Rubber Gloves,Von Inc,vial,Decimus cibo derelinquo pauci aveho callide ars amet argumentum curriculum.,2025-03-27 12:45:41
141,4,Oriental Cotton Bike,O'Keefe - Klein,tablet,Turba tutis verumtamen animi reprehenderit creator.,2025-04-22 01:49:40
142,7,Refined Steel Table,Wolf Inc,tablet,Aequitas articulus accedo amplitudo tunc debilito cotidie molestiae.,2025-10-18 22:23:56
143,10,Frozen Rubber Shoes,"Kozey, Koss and Kub",tablet,Conforto argumentum tergum averto conqueror cohaero stella surgo.,2025-11-04 14:00:47
144,9,Unbranded Steel Cheese,"Emard, Cummerata and Hane",tablet,Molestiae quia vereor.,2025-04-11 23:34:26
145,1,Handcrafted Metal Hat,Romaguera - McCullough,bottle,Vulgus aggredior beneficium cohors cohibeo odit aestivus.,2025-02-03 01:06:16
146,3,Elegant Gold Tuna,Bartoletti LLC,box,Demonstro absconditus capitulus libero volva balbus auditor curso.,2025-05-11 18:50:54
147,8,Incredible Wooden Sausages,"Kunze, Cormier and Moen",vial,Temperantia umerus constans sto adfero.,2025-12-03 17:22:14
148,1,Frozen Marble Chips,Watsica - Shields,tablet,Creptio velut laudantium facere antiquus cubo thermae.,2025-03-23 09:13:56
149,8,Oriental Rubber Ball,Hane - Runte,bottle,Deleniti audacia creta coadunatio adnuo conor admoveo tergiversatio impedit apud.,2025-08-02 19:18:08
150,7,Licensed Gold Cheese,Fay Group,bottle,Curo subito temeritas certus uterque combibo.,2025-04-17 11:29:04
151,8,Handcrafted Ceramic Ball,Kunze Inc,box,Admoneo textus strenuus creo alienus voco accommodo triumphus.,2026-01-07 20:43:17
152,9,Generic Cotton Salad,"Satterfield, Dickinson and Feest",tablet,Quibusdam sumo velit.,2025-12-17 17:04:33
153,9,Fresh Silk Gloves,"Kunze, Douglas and Frami",tablet,Autem ascit tollo spectaculum.,2025-03-01 10:07:47
154,2,Rustic Granite Bike,Hodkiewicz Group,box,Commodi quis sopor voluptatibus provident quasi clam confero crur vos.,2025-02-17 17:17:48
155,1,Intelligent Steel Mouse,Goodwin - Flatley,bottle,Anser concedo valde adflicto ullus curso.,2025-11-27 06:55:32
156,10,Practical Bronze Bacon,Baumbach - Corwin,tablet,Socius tabernus abutor stultus conscendo agnosco traho.,2025-03-19 20:48:54
157,1,Awesome Bronze Pants,White - Gleichner,box,Anser arma minima.,2025-07-09 23:55:12
158,9,Tasty Ceramic Fish,Monahan - Franecki,tablet,Articulus contra calco debilito tertius cohibeo cubitum ipsa.,2025-06-11 12:35:23
159,3,Oriental Bronze Chips,Pacocha - Ruecker,bottle,Desidero solus ait venustas perferendis paens timor vicissitudo voveo sapiente.,2025-02-09 12:10:48
160,5,Fantastic Rubber Table,"Harber, Green and Feeney",tablet,Cervus cito auxilium summopere amita circumvenio sub trado.,2025-10-05 00:44:36
161,1,Licensed Cotton Chair,"Hickle, Hirthe and Jenkins",vial,Nesciunt tres undique voluptatibus.,2025-10-29 07:36:46
162,3,Intelligent Wooden Bacon,Kiehn - Goodwin,bottle,Absque summa stabilis excepturi agnosco pauper cupiditas compello.,2025-05-21 05:58:32
163,9,Fantastic Concrete Fish,"Block, Hilpert and Blanda",tablet,Beneficium conservo tardus astrum maiores comptus annus ater.,2025-01-23 21:36:37
164,10,Handcrafted Rubber Sausages,Schumm Group,bottle,Tergiversatio collum tibi tunc benevolentia.,2026-01-18 17:17:59
165,8,Practical Concrete Tuna,Maggio and Sons,bottle,Appono atrox absque alias carmen.,2025-07-30 07:18:53
166,7,Unbranded Steel Table,"Walker, Gislason and Schiller",tablet,Curso suus subvenio conventus saepe comis decerno contra.,2025-09-07 09:37:02
167,7,Unbranded Wooden Chips,Crist - Bartoletti,curis,Error cubo succedo volutabrum.,2025-08-02 03:35:10
168,3,Generic Plastic Cheese,Adams - McCullough,vial,Appono decretum claro sodalitas inventore cognomen condico depereo.,2025-02-25 06:01:13
169,8,Tasty Ceramic Gloves,Kerluke - Hand,vial,Patria apud statua somniculosus.,2025-05-22 17:54:32
170,3,Recycled Ceramic Bike,"Kohler, Leannon and Predovic",vial,Baiulus vulticulus voluptas.,2025-05-10 19:20:54
171,2,Elegant Cotton Pants,Schimmel - Casper,bottle,Delicate a auditor sortitus adficio tabula cibo tantum.,2025-08-21 06:05:53
172,8,Oriental Steel Shirt,Cruickshank - Hettinger,box,Vinum super sunt advenio acies.,2025-08-24 19:39:57
173,8,Handcrafted Rubber Cheese,Gorczany Group,tablet,Alias laboriosam coma depono denego acsi solutio tabgo turbo.,2025-12-05 14:36:55
174,6,Handmade Plastic Gloves,"Runte, Zieme and Kshlerin",tablet,Modi omnis adipisci tonsor.,2025-05-09 19:30:45
175,6,Unbranded Steel Bacon,"Lebsack, Mante and Sanford",bottle,Ea centum sit tantum adimpleo auctor deleniti.,2026-01-10 01:43:50
176,5,Handcrafted Gold Chicken,Gutkowski - Leannon,tablet,Decipio voluntarius sophismata.,2025-05-01 04:09:00
177,2,Fresh Silk Keyboard,Johnston LLC,ullus,Coruscus correptius amiculum.,2025-12-20 00:35:29
178,1,Recycled Cotton Computer,Erdman and Sons,bottle,Vacuus recusandae attollo.,2025-01-30 08:38:41
179,10,Fresh Ceramic Bike,"Stehr, Okuneva and Kreiger",box,Amiculum beatae amiculum ocer auxilium avaritia.,2025-05-08 23:47:23
180,1,,"Harber, Block and Schneider",apto,Adsum denego suspendo capio conor suscipit tenetur cursus administratio.,2025-09-15 06:07:35
181,4,Small Wooden Tuna,Jenkins - Rolfson,box,Vinculum subseco tumultus clibanus cum vestigium admoneo coepi.,2025-09-11 02:28:07
182,8,Rustic Cotton Soap,Macejkovic LLC,vial,Cinis cohors saepe campana.,2025-03-05 05:53:35
183,7,Sleek Marble Car,Leannon - Hayes,vial,Verto voluptatem vallum statua odit caste tremo.,2025-11-21 04:14:44
184,3,Practical Granite Cheese,"Smith, Price and Mayer",bottle,Sunt ater peccatus depono bene ulciscor infit cur ipsam.,2025-05-09 01:45:33
185,10,Small Marble Sausages,Collins - Rodriguez,bottle,Tabula defluo adeo validus abscido bellicus creber accusator.,2025-12-28 13:40:59
186,2,Bespoke Wooden Computer,Heidenreich - Hessel,bottle,Thesaurus tutis succedo compono tamquam territo ager crur.,2025-05-29 12:54:27
187,8,Intelligent Aluminum Pants,"Hills, Bruen and Streich",bottle,Velit crux non sophismata admoveo verus varius.,2026-01-08 18:24:28
188,9,Luxurious Bamboo Salad,Mayer - Abernathy,tablet,Acer decretum demulceo acerbitas terga veritatis utilis triumphus vulgivagus certus.,2025-09-03 09:10:55
189,7,Refined Marble Chicken,Wisoky - Hirthe,vial,Eum aro vallum patrocinor.,2025-09-08 09:26:07
190,6,Frozen Marble Pants,"Jast, Dare and Senger",box,Audio dolore vero cado confugo comburo centum.,2025-12-11 03:12:38
191,7,Bespoke Marble Shirt,Graham - Yost,box,Deficio accusator crebro spoliatio aer decor tum suppono suspendo.,2025-04-08 12:08:07
192,4,Modern Rubber Towels,Wolf and Sons,vial,Acerbitas viriliter esse stillicidium colo facere stips.,2025-12-13 18:44:43
193,7,Frozen Metal Pizza,"Hodkiewicz, Labadie and Kshlerin",bottle,Auctus tremo absconditus cur valens voluptatum vero asporto.,2025-08-21 00:35:31
194,6,Elegant Rubber Shoes,Wisoky LLC,vial,Accusantium suffoco tribuo.,2025-05-14 15:40:01
195,5,,Stokes - Jacobs,demum,Aggredior cattus distinctio bonus angulus eaque cogito vorax amet comburo.,2025-12-08 03:21:17
196,7,Frozen Wooden Table,"Tillman, Wuckert and Hansen",box,Ut adhaero adhaero expedita absque eum templum denuo.,2025-02-28 01:15:34
197,6,Unbranded Concrete Fish,"Sawayn, Larkin and Orn",bottle,Utique explicabo adinventitias ademptio.,2025-04-26 12:05:19
198,2,Handcrafted Silk Gloves,Larkin - Nolan,vial,Absum atrocitas tepidus aqua cupiditate.,2025-11-15 03:02:15
199,9,Generic Wooden Salad,Ullrich Inc,bottle,Apud defendo voluptatem cicuta.,2025-12-02 20:18:27
200,1,Frozen Granite Tuna,Kuvalis - Witting,box,Claro benigne vulariter creptio sublime vorax adeo demoror defetiscor benigne.,2025-02-06 03:34:56
201,4,Small Bronze Keyboard,Gibson - Mohr,tablet,Corona arbustum officia pecco concedo aureus bonus aiunt.,2025-04-13 10:49:16
202,8,Sleek Metal Mouse,Macejkovic and Sons,vial,Triduana sub sollicito degero thema aegrus rerum cetera.,2025-12-13 04:10:54
203,4,Modern Concrete Chips,Baumbach and Sons,tablet,Talus consequatur ulterius pariatur synagoga armarium.,2025-02-26 01:04:45
204,10,Fresh Granite Pizza,Rice - Hilll,box,Ventosus agnitio spiculum sperno vespillo denique.,2026-01-18 05:59:40
205,8,Ergonomic Steel Cheese,"Bosco, Christiansen and Murazik",bottle,Cunabula voluptatum tergiversatio argentum coruscus vulgaris.,2026-01-11 21:54:46
206,4,Soft Silk Tuna,Nikolaus - Runolfsdottir,tablet,Agnosco verto tubineus ter cattus vado aestus.,2025-06-21 22:10:15
207,4,Handcrafted Plastic Towels,Reynolds LLC,tablet,Cernuus sapiente tempora infit speculum abstergo damnatio copiose accommodo aestivus.,2025-01-24 16:36:06
208,4,Recycled Ceramic Shirt,Little - Bergstrom,tablet,Adaugeo turpis sum atrocitas creptio brevis.,2026-01-20 00:54:54
209,5,Licensed Steel Cheese,McLaughlin Inc,box,Umbra titulus tergeo alo aer.,2025-05-18 15:52:02
