medicine_id,category_id,name,brand,unit,description,created_at
210,1,Soft Marble Ball,Walter Group,tablet,In demens nulla ambitus curis.,2025-04-04 17:14:13
211,8,Fresh Bronze Fish,Kihn - Berge,bottle,Spiculum depraedor cedo vilis virtus attollo.,2025-02-22 05:02:12
212,10,Modern Rubber Car,"Ryan, Nicolas and Swaniawski",bottle,Alii ipsum ademptio sollicito.,2025-08-04 20:13:06
213,3,Frozen Granite Fish,Runolfsson - Dare,bottle,Tum theatrum provident voluptatum atavus ara.,2025-05-30 01:03:04
214,5,Sleek Marble Salad,Rogahn - Torp,vial,Atqui viridis rerum eveniet crepusculum pecus.,2026-01-02 00:10:26
215,1,Awesome Marble Soap,"Barton, Kuhlman and Labadie",vial,Argumentum quae consequatur vester.,2026-01-12 11:00:59
216,2,Soft Rubber Cheese,Torphy and Sons,vial,Validus agnosco vehemens.,2025-02-11 22:18:41
217,1,Generic Bronze Pizza,Haag Inc,vial,Aduro ter pecco antiquus saepe velut ulciscor canonicus.,2025-10-07 18:34:47
218,4,Frozen Plastic Shirt,Miller - Koch,box,Angustus adduco absque torqueo creta crux terreo.,2025-12-30 02:18:30
219,10,Refined Silk Chair,Corwin Inc,bottle,Versus cognatus cras cimentarius.,2025-06-17 01:50:29
220,9,Fantastic Aluminum Bacon,"Haley, Jacobson and Koss",bottle,Denuncio tergo assumenda sordeo.,2025-07-16 23:04:12
221,1,Modern Rubber Shoes,Reilly LLC,bottle,Adstringo denuo clementia caelum cresco.,2025-08-04 22:32:42
222,9,Licensed Gold Car,Kohler and Sons,bottle,Civis patruus cernuus solus aspernatur vitiosus vesper curvo suppono.,2025-11-29 11:39:59
223,2,Modern Gold Ball,"Mitchell, Cummerata and Ondricka",bottle,Cui avarus venia suus corroboro.,2025-04-05 05:23:06
224,4,Handmade Wooden Chips,"Schimmel, Schmidt and Kertzmann",bottle,Depulso asper aestas comptus quas sunt cometes patrocinor nulla voluptas.,2025-09-13 23:45:26
225,9,Bespoke Aluminum Salad,"Senger, Jacobs and Sawayn",vial,Creta cavus possimus solvo ustilo succurro beneficium comminor barba.,2025-11-10 00:13:41
226,9,Handmade Steel Mouse,Wisozk LLC,box,Compono vociferor cupiditate curriculum censura.,2025-06-22 01:54:27
227,4,Luxurious Cotton Pants,"Harber, Rempel and Rogahn",bottle,Debeo deserunt carus.,2025-12-18 16:44:55
228,5,Luxurious Bamboo Chips,Daniel Group,vial,Cognatus agnosco tactus stultus magni suppono terminatio decipio.,2025-12-21 00:25:23
229,3,Handcrafted Ceramic Pants,Emmerich and Sons,bottle,Amplexus amor turbo quod surgo accendo victoria.,2025-10-25 13:04:44
230,10,Soft Gold Fish,Nitzsche LLC,vial,Color armarium vociferor canis arma aperte apto angelus modi.,2025-04-21 07:56:35
231,7,Awesome Silk Towels,Leffler Inc,tablet,Admitto corrumpo tenuis benevolentia absconditus suscipio crastinus.,2025-07-30 16:52:15
232,7,Intelligent Metal Cheese,Effertz - Gutkowski,tablet,Sustineo aiunt thermae.,2025-08-26 04:50:55
233,1,Rustic Gold Hat,Shields - Keeling,bottle,Omnis paens viriliter debeo vinculum ubi audeo urbanus commemoro.,2026-01-01 05:39:09
234,8,Licensed Marble Towels,Feest Inc,vial,Apto accusamus ago tempore calcar vinum.,2025-02-01 06:02:44
235,3,Ergonomic Rubber Salad,Quigley - Klocko,tablet,Aperio aro cunctatio.,2025-05-18 12:45:15
236,8,Incredible Cotton Pants,VonRueden - Heathcote,box,Toties derelinquo teres.,2025-03-22 11:26:07
237,2,Electronic Marble Table,Macejkovic - Gerhold,bottle,Patria harum territo urbanus virgo.,2025-02-05 13:14:03
238,2,Licensed Steel Computer,Collins Inc,bottle,Quam defleo soluta sed tutamen depereo laboriosam averto.,2025-09-04 22:27:12
239,4,Unbranded Rubber Fish,Connelly Inc,box,Corona attollo nostrum sonitus provident audax aperiam subito.,2025-04-02 04:20:20
240,7,Refined Plastic Soap,Schulist Inc,bottle,Sunt vulgivagus crur bos concido corroboro aliqua sunt.,2025-02-19 04:20:38
241,10,Incredible Bronze Chair,Conn - Morar,box,Coadunatio adficio socius sortitus accusamus possimus caecus suscipio cena consuasor.,2025-05-20 18:30:04
242,9,Intelligent Bronze Fish,"Runolfsson, Buckridge and Kautzer",box,Bibo volaticus vitae studio adflicto timidus aeneus nobis una.,2025-04-04 12:13:04
243,1,Modern Steel Chicken,"Bartell, Halvorson and Marquardt",bottle,Vorax ventosus numquam tumultus contigo.,2025-06-20 15:10:14
244,10,Bespoke Metal Table,Emmerich Group,vial,Ipsa peior succedo conicio demonstro corrupti.,2025-10-14 13:28:16
245,4,Fresh Bronze Hat,Howe LLC,bottle,Ter demens temperantia confero totam.,2025-04-05 09:31:05
246,2,Small Cotton Towels,Koch and Sons,bottle,Conculco aegrotatio fuga.,2026-01-13 00:17:03
247,5,Modern Metal Keyboard,Price Group,vial,Vomito adsuesco vaco cernuus votum timidus asporto peccatus.,2025-10-02 01:52:40
248,8,Small Wooden Bike,Dibbert - Swaniawski,box,Soluta triumphus deludo utor titulus incidunt.,2025-10-06 18:05:44
249,6,Luxurious Ceramic Tuna,Weimann - Kilback,box,Corpus mollitia cunae recusandae dolorem substantia coaegresco antepono aureus tepidus.,2025-04-11 23:41:44
250,5,Tasty Metal Tuna,Stroman - Padberg,box,Barba desipio peior compello aufero succurro.,2025-05-27 22:48:22
251,2,Recycled Aluminum Chair,Berge Inc,vial,Curo comes sono bonus enim audax.,2025-05-01 06:52:06
252,5,Ergonomic Marble Cheese,Hickle Inc,box,Cunctatio cauda velociter cohaero illum corrigo.,2025-11-28 13:32:59
253,7,Handcrafted Plastic Tuna,Turcotte - Moore,vial,Cotidie temporibus constans vinum deinde.,2025-03-13 03:58:32
254,5,Licensed Marble Bike,Herzog Inc,tablet,Libero tamquam defungo.,2025-10-25 07:00:19
255,4,Electronic Granite Car,Trantow - Hills,box,Virga sapiente uredo alius animadverto vito laborum sumptus.,2025-07-28 23:42:33
256,10,Tasty Marble Towels,Barton - Medhurst,tablet,Demo veritas verumtamen commodi studio clam contra in.,2025-09-24 11:47:04
257,2,Handmade Bamboo Soap,"Rau, Ryan and Waters",vial,Tergiversatio temporibus solio ut audeo.,2025-06-06 16:20:39
258,2,Oriental Plastic Pants,Trantow and Sons,bottle,Tremo perferendis pel.,2025-03-19 06:50:10
259,8,Ergonomic Gold Chicken,Little and Sons,bottle,Avaritia tantum xiphias vilis comis.,2026-01-18 09:01:27
260,2,Incredible Aluminum Bike,Volkman and Sons,vial,Cras assumenda altus amo angustus abundans.,2025-06-20 05:06:13
261,5,Sleek Marble Shoes,"Leuschke, Runolfsdottir and White",vial,Verecundia despecto contigo ut caveo auctor teneo vos.,2025-06-20 04:00:35
262,8,Licensed Rubber Hat,Dickens - Mills,bottle,Casso stips beatae denego conicio comprehendo clam atque defaeco.,2025-09-20 14:20:46
263,1,Luxurious Gold Keyboard,"Grimes, Murray and Gorczany",bottle,Porro vere aequus sopor charisma campana artificiose argentum bibo umbra.,2025-09-03 13:48:10
264,7,Recycled Rubber Salad,Jakubowski - Brown,vial,Succedo laborum terra validus summisse.,2025-08-24 19:53:20
265,10,Generic Plastic Pants,"Boyer, Botsford and Gerhold",box,Patruus tenuis beatae.,2025-07-02 07:11:44
266,6,Frozen Bamboo Pizza,Bailey - Stracke,tablet,Adstringo atrox super cras harum abbas.,2025-10-28 20:04:59
267,4,Elegant Gold Shoes,"Berge, Hettinger and Williamson",tablet,Debilito sui timidus consequatur conforto defero confero.,2025-09-01 00:51:03
268,10,Handmade Silk Computer,"Abshire, Muller and Herzog",vial,Curriculum eveniet vacuus error voluptatibus caries dicta confero.,2026-01-13 07:45:14
269,6,Fantastic Ceramic Computer,Witting LLC,tablet,Angulus calamitas bibo torqueo.,2025-10-01 09:55:04
270,3,Soft Steel Fish,Bosco - Swaniawski,box,Cubitum dens suspendo tenetur terebro blandior.,2025-04-16 18:21:51
271,9,Ergonomic Plastic Chips,Treutel - Bernier,bottle,Basium unde veniam desino callide utrimque.,2025-10-20 04:06:47
272,1,Sleek Bronze Towels,O'Hara and Sons,vial,Vir conscendo advenio studio eligendi curso.,2025-12-02 05:30:03
273,10,Gorgeous Cotton Shirt,"Dibbert, Hettinger and Schaden",box,Depopulo verbera cunctatio.,2025-09-02 04:15:35
274,4,Soft Granite Gloves,Hamill Group,vial,Sursum conatus adinventitias patruus.,2025-09-25 18:35:49
275,3,Unbranded Plastic Table,Langworth LLC,tablet,Deinde utrum viriliter.,2025-11-02 05:10:11
276,4,Frozen Rubber Shirt,"Schroeder, Boehm and Thompson",vial,Benevolentia corpus sed pariatur adhuc bellicus ambitus umquam depulso.,2025-08-03 20:58:57
277,2,,"Kilback, Hermiston and Balistreri",vial,Canonicus labore officiis cavus cometes conforto deleo casus dens.,2025-02-06 00:11:15
278,2,Handmade Bamboo Chips,"Hahn, Gorczany and Nolan",box,Tero vulgaris vir textus cotidie aeneus.,2025-05-09 14:33:57
279,7,Bespoke Wooden Computer,Mills LLC,tablet,Calco tersus angulus demulceo stabilis angustus velum vigor stabilis.,2025-04-23 10:10:29
280,10,Frozen Aluminum Soap,Schultz - Swaniawski,tablet,Viscus sequi acer atavus varius debitis desolo torrens tantum vigor.,2025-03-28 02:27:19
281,2,Small Concrete Soap,"White, Heidenreich and Heaney",box,Aiunt trans conculco consuasor abstergo.,2026-01-02 00:28:38
282,6,Gorgeous Cotton Salad,Lueilwitz - Price,box,Totidem careo congregatio arbustum.,2025-09-19 01:03:46
283,1,Small Plastic Hat,"Spencer, Fadel and Torp",vial,Alo timor socius thymum.,2025-07-22 06:31:20
284,3,Tasty Marble Pants,Beer - Hyatt,bottle,Autem aggero conor amplus patruus bellum alo non.,2025-05-07 00:03:44
285,6,Electronic Plastic Sausages,Stracke Group,tablet,Vix succedo audax succurro credo theca vis.,2025-04-15 19:02:39
286,8,Practical Concrete Table,Boehm and Sons,bottle,Suffragium desino similique.,2025-02-07 01:26:24
287,8,Awesome Marble Hat,VonRueden - Hane,vial,Vulgus speciosus angustus caveo demoror deorsum eos temeritas degero culpa.,2025-06-16 16:18:26
288,7,Small Gold Table,McClure - D'Amore,vial,Tum quia ait supellex crinis patrocinor credo labore bibo.,2025-10-20 17:41:56
289,7,Refined Cotton Shirt,Sporer LLC,bottle,Avaritia dolorem soluta vesica tepidus contabesco veritatis fugit aequus vilitas.,2025-12-22 11:33:23
290,4,Rustic Ceramic Keyboard,Wiegand - Oberbrunner,bottle,Voluptatum ater fugiat aureus alii tersus solus tempora caste.,2025-02-22 06:47:15
291,5,Licensed Plastic Gloves,"Leannon, Von and Jaskolski",box,Concido deporto degusto deserunt amo caveo subito complectus canis.,2025-12-05 00:12:58
292,6,Handmade Bronze Bike,"Mann, Rosenbaum and Sporer",tablet,Curis avarus alius taceo tamquam esse.,2025-09-09 09:43:42
293,1,Modern Bamboo Shirt,Rodriguez - Wehner,vial,Utrimque calculus viridis umerus adicio crur.,2025-03-15 04:03:10
294,3,Electronic Metal Pizza,"Fisher, Fadel and Klein",bottle,Avaritia quam ademptio celebrer crapula clam antiquus.,2025-04-05 01:58:10
295,8,Fresh Wooden Tuna,Spinka LLC,bottle,Ventosus coruscus conforto tantum tantillus admitto damno stipes somnus.,2025-11-15 07:53:09
296,4,Modern Bamboo Car,Bernhard - Leannon,box,Tempus spero trepide decerno terreo vulgo degero.,2025-10-09 21:35:08
297,5,Rustic Marble Pants,Wilderman Inc,bottle,Cavus cibus voluptates aureus tandem ocer crastinus defendo ater sapiente.,2025-04-09 04:27:04
298,1,Handcrafted Plastic Shirt,Ondricka Group,bottle,Conforto tamquam urbs aro utrum attero.,2025-10-25 12:26:45
299,5,Modern Plastic Bacon,Smitham and Sons,box,Aeger paulatim excepturi abduco tertius volubilis contabesco tamisium basium usitas.,2025-09-13 20:10:37
300,7,Soft Cotton Pants,McLaughlin and Sons,tablet,Optio terra argumentum cuppedia ad crebro acer subiungo.,2025-05-03 05:37:23
301,5,Oriental Plastic Hat,Bechtelar - Swaniawski,bottle,Victus defluo doloribus alius quasi summisse sollers corrupti denique.,2025-02-16 14:21:19
302,6,Generic Bamboo Car,Kilback - Greenholt,bottle,Suffoco colo adnuo.,2025-06-02 04:53:31
303,2,Small Gold Pizza,Stamm Inc,bottle,Atqui attollo cunabula compello supra amissio impedit acerbitas apud.,2025-03-04 06:42:54
304,9,Oriental Wooden Bacon,"Lang, Ziemann and Hettinger",vial,Utpote tametsi suffragium cupressus esse torrens.,2025-08-07 01:00:42
305,10,Gorgeous Plastic Cheese,Emmerich - Olson,bottle,Conscendo veritatis caput demonstro territo cenaculum desino enim territo defetiscor.,2025-10-29 01:21:40
306,2,Recycled Aluminum Towels,Jenkins - Gislason,tablet,Annus patruus candidus desidero cimentarius.,2025-01-30 03:50:10
307,3,Practical Marble Towels,Dickens - Altenwerth,bottle,Degenero correptius compono.,2025-12-04 05:47:59
308,10,Soft Silk Mouse,Flatley - Luettgen,vial,Bellicus curis sit apud umerus.,2025-12-29 23:06:00
309,1,Recycled Metal Hat,"Koelpin, Parisian and Simonis",bottle,Vilicus caste apparatus rerum vereor.,2025-02-12 08:57:09
310,10,Fantastic Rubber Tuna,Rempel Group,tablet,Denuo laboriosam testimonium bellum sonitus maxime.,2025-11-05 14:06:02
311,1,Handcrafted Wooden Shirt,Conn - Nienow,bottle,Ducimus teres tutamen aureus civis appello pariatur qui coadunatio.,2025-11-14 03:34:14
312,8,Recycled Bronze Gloves,"Treutel, Klocko and Tremblay",box,Ademptio cariosus solus verecundia defetiscor conscendo.,2025-05-08 01:06:53
313,8,Fresh Bamboo Chicken,"Senger, Weimann and Murazik",vial,Vere artificiose sto clam arx virga.,2025-03-16 12:24:20
314,8,Intelligent Silk Hat,"Lemke, Prohaska and Wunsch",box,Molestias tenetur currus ulterius.,2025-04-04 00:27:44
315,6,Fantastic Gold Shoes,Hyatt - Trantow,blanditiis,Tamen eligendi catena arbustum corroboro conduco non vae odit theca.,2025-12-08 07:02:00
316,9,Small Ceramic Towels,"Luettgen, Connelly and Rodriguez",box,Congregatio aptus sublime acies caecus denuo sponte ago.,2025-05-09 16:47:16
317,2,Awesome Bronze Tuna,"Nader, Altenwerth and Hand",vial,Demo despecto claustrum delectus utpote arcus communis pariatur strenuus.,2025-04-11 19:32:31
318,10,Handmade Wooden Keyboard,"Hagenes, Kulas and Renner",vial,Balbus thymbra arcesso cursus.,2025-08-05 13:19:40
319,9,Handcrafted Wooden Hat,"Maggio, Johnson and Hauck",box,Barba defendo curatio cruciamentum venustas temeritas peior.,2025-11-17 20:54:05
320,8,Soft Granite Pants,Lebsack - Pfeffer,vial,Benigne sapiente solvo approbo non tamen.,2026-01-11 02:13:38
321,9,Tasty Silk Chair,Walker Group,box,Aduro denuncio nihil vae spiculum adamo summa defessus voluptate.,2025-06-03 14:08:21
322,9,Fresh Marble Gloves,"Gulgowski, Bruen and Braun",bottle,Stipes vestrum teres consequatur arca soluta itaque cinis.,2025-08-14 09:41:06
323,5,Modern Granite Salad,"Kuphal, Leannon and Graham",bottle,Necessitatibus distinctio utor arto vitium thesis cribro.,2025-02-07 04:29:27
324,9,,Murray - Mueller,tablet,Cubitum culpo copia tibi dignissimos.,2025-06-02 05:02:11
325,2,Oriental Gold Salad,Schroeder - Gorczany,tablet,Cenaculum vulgo praesentium sed alter odio cubicularis.,2026-01-19 00:17:01
326,3,Frozen Wooden Tuna,Lubowitz LLC,box,Vindico certus desipio praesentium depono aspernatur subiungo cervus cedo.,2025-11-13 00:39:33
327,3,Handmade Cotton Soap,Cruickshank - Cole,tablet,Depereo suppellex testimonium vilitas derelinquo.,2025-11-17 19:05:42
328,6,Gorgeous Granite Chips,Keeling and Sons,box,Bonus eveniet apparatus dolorum.,2025-07-15 07:26:21
329,1,Practical Bamboo Shoes,Cremin Group,vial,Doloremque absens molestiae quasi considero texo bonus canis summisse anser.,2025-07-29 15:58:32
330,2,Soft Concrete Gloves,Bayer Inc,vial,Adficio quam conturbo corrigo.,2025-03-18 01:05:36
331,10,Recycled Wooden Keyboard,Howell Inc,box,Expedita velum quidem denuo tribuo conitor ipsam cribro sublime teres.,2025-12-29 08:05:12
332,9,Oriental Rubber Towels,Zboncak - Nolan,tablet,Ventus tabgo adaugeo sufficio defaeco solum.,2025-06-05 21:40:50
333,8,Practical Steel Chips,West Inc,bottle,Conspergo sapiente utrimque thymum.,2025-02-04 13:12:17
334,4,Fresh Ceramic Table,"Cummerata, Kris and Aufderhar",tablet,Crudelis delinquo vehemens vulticulus sulum crapula theca basium tener.,2025-06-10 23:08:54
335,7,Fresh Silk Fish,"Sanford, Gerlach and Hickle",tablet,Pectus abutor talus bibo saepe.,2025-02-09 07:32:13
336,5,Licensed Wooden Pizza,Maggio Inc,bottle,Apostolus caveo aegrus tamquam tepesco charisma volubilis coruscus.,2025-11-25 09:45:46
337,2,Sleek Steel Towels,Wiza - Bayer,bottle,Peior aduro cupressus.,2025-08-07 21:35:57
338,2,Rustic Granite Pants,Hermiston Inc,tablet,Tantum candidus calculus denuo astrum denego thesaurus.,2025-08-20 12:51:51
339,3,Handmade Concrete Computer,Haag - Becker,bottle,Caelestis asperiores viscus umquam adeo.,2025-02-11 21:45:03
340,3,Rustic Ceramic Chair,"Gottlieb, Torphy and Larson",bottle,Audacia argentum comedo pecto repudiandae stultus sed.,2025-06-15 06:40:48
341,3,Small Plastic Chips,"Mueller, Metz and Glover",alioqui,Ultio turpis soleo comis suasoria vulariter contabesco agnitio sollers cuius.,2025-06-14 22:01:58
342,7,Small Bamboo Tuna,Ratke Group,tablet,Quasi ago aeternus defungo voluptatem curatio sint aegrotatio quas thesaurus.,2025-07-08 09:22:46
343,7,Generic Rubber Bacon,Ullrich - Prosacco,vial,Ultio accusamus comprehendo ducimus deserunt turpis enim cometes arguo dicta.,2025-05-18 05:54:44
344,3,Luxurious Granite Chicken,Hickle Inc,bottle,Tenuis adipisci sortitus paulatim.,2025-10-27 23:45:13
345,8,Luxurious Ceramic Fish,Stark Group,tablet,Curvo cuppedia suffoco vivo denique patruus nemo utique suscipit.,2025-07-05 00:26:48
346,8,Luxurious Marble Bike,"Lind, Bogan and Pfeffer",tablet,Abundans deporto ver absconditus.,2025-08-19 11:13:23
347,4,Tasty Ceramic Cheese,Stokes - Swaniawski,tablet,Defaeco adiuvo colligo taceo copia amor surculus vobis capitulus.,2025-06-27 23:21:54
348,4,Handcrafted Marble Chair,Jerde - Nitzsche,tablet,Validus a textilis textor molestiae cunae.,2025-07-28 02:01:57
349,2,Frozen Cotton Towels,Terry - Buckridge,vial,Tam solus mollitia statim aut.,2025-05-27 00:15:07
350,5,Small Cotton Hat,Morar Group,box,Conturbo vomica comes eius adulatio tamen asporto velociter bis.,2025-09-06 17:37:26
351,2,Recycled Aluminum Tuna,Sawayn - Gorczany,box,Brevis aduro cunae.,2025-11-25 01:18:15
352,2,Handcrafted Metal Sausages,Smith - Spinka,vial,Certus validus velum tristis tamen cedo.,2025-03-01 22:00:45
353,7,Recycled Silk Hat,"Hartmann, Bogisich and Thiel",box,Admiratio cernuus nam valde sol contabesco.,2025-06-07 02:31:05
354,1,Bespoke Metal Fish,Kertzmann - Friesen,vial,Super verbum conservo via vehemens aliquam contra damnatio.,2025-04-20 08:33:53
355,3,Ergonomic Silk Mouse,"Kuhn, Satterfield and Walsh",bottle,Labore aer acer adsidue censura amo teneo consuasor accusamus caute.,2025-04-02 19:05:08
356,10,Fantastic Granite Gloves,Turner Inc,bottle,Expedita adiuvo delibero urbs decens tantillus.,2025-06-21 05:19:12
357,6,Ergonomic Steel Sausages,Kihn Inc,vial,Facere tribuo adicio arcesso atrox reprehenderit.,2025-04-07 15:18:04
358,7,Bespoke Bamboo Gloves,Mohr - Dach,box,Neque tepesco atrox ipsam agnosco nobis vapulus.,2025-10-13 02:51:02
359,3,Recycled Metal Sausages,Bogisich - Legros,bottle,Inventore doloribus qui victus allatus approbo subiungo aequus adulatio.,2025-06-04 12:09:15
360,9,,Kunde and Sons,vial,Tabgo uterque territo tempore adulescens temporibus distinctio quibusdam spectaculum volup.,2025-06-19 13:09:13
361,7,Soft Plastic Shirt,Mayert LLC,bottle,Depono ascit caput.,2025-04-27 06:46:01
362,9,Fantastic Bronze Salad,Johnson - Bruen,vial,Copiose triduana capio audio coepi crur.,2025-09-27 10:56:03
363,7,Refined Granite Table,Heidenreich - Schuppe,bottle,Terra tempora victus denique velum cursus caste clam.,2025-08-29 06:29:42
364,6,Licensed Cotton Ball,Hackett - Mante,tablet,Theatrum derideo arcesso angustus totam fugiat conscendo ipsa.,2025-01-26 23:14:37
365,6,Licensed Plastic Tuna,Wiza - Mitchell,bottle,Quae dolor depromo advenio concedo vesica adfero facilis sonitus.,2025-09-28 00:54:22
366,2,Intelligent Plastic Chicken,Littel LLC,box,Soleo dolorum approbo vere qui accedo fuga benigne cruentus.,2025-03-27 23:16:21
367,7,Licensed Bronze Ball,Reichel LLC,box,Deporto venustas subseco assumenda spectaculum dedico dolor.,2025-03-24 18:28:28
368,1,Tasty Granite Bacon,"Aufderhar, Abbott and Feil",box,Ante unus cubitum.,2025-04-22 03:02:28
369,9,Intelligent Ceramic Salad,Hilll Group,tablet,Cubitum ratione cervus.,2025-02-10 17:26:18
370,6,Ergonomic Ceramic Chips,Kunde and Sons,tablet,Nam solutio cetera itaque caries conturbo argumentum campana bene.,2025-05-02 04:11:52
371,9,Fantastic Steel Keyboard,Runolfsson - Dietrich,vial,Decumbo utilis advoco assumenda aedificium capio derelinquo deserunt.,2025-02-16 02:16:10
372,1,Unbranded Wooden Fish,Jaskolski - Hilll,box,Conatus volup strenuus.,2025-02-13 00:02:00
373,3,Ergonomic Gold Car,Kohler - Ankunding,vial,Mollitia conculco deficio.,2025-12-21 00:24:36
374,8,Rustic Cotton Chicken,"Bechtelar, Brakus and Luettgen",box,Apud trepide adeo aequus cetera demo adhaero cumque sperno.,2025-03-15 11:34:15
375,7,Oriental Cotton Pants,"Weissnat, Hane and Roob",vial,Thema video carcer textilis congregatio textor tertius cognomen aro.,2025-05-07 03:05:06
376,6,Handcrafted Aluminum Ball,Grant Group,bottle,Claudeo voro et animadverto.,2025-02-26 18:57:20
377,4,Tasty Granite Soap,Beer - Smitham,tablet,Deputo vigilo canto barba desidero cometes cresco.,2025-08-03 07:01:02
378,3,Modern Bamboo Hat,"Batz, Lang and Parisian",tablet,Tabernus solus cunctatio vigilo cibo.,2026-01-12 00:23:46
379,1,Soft Concrete Keyboard,Fahey - Swift,bottle,Teres cur reprehenderit cito cupio avaritia tredecim.,2025-11-23 20:01:43
380,7,Gorgeous Metal Computer,"MacGyver, Greenfelder and Nicolas",box,Nobis temperantia cavus vestrum amet compello civitas credo vado vociferor.,2025-02-16 21:09:37
381,2,Sleek Bronze Hat,Turner - Jast,bottle,Aliquid amo communis volo.,2025-09-10 23:30:58
382,7,Rustic Rubber Sausages,Russel Group,tablet,Ter adflicto stipes tribuo absens id aegrus ulterius suscipit.,2026-01-19 08:12:04
383,4,Modern Marble Computer,Cummings and Sons,bottle,Vivo comprehendo utpote arbustum desidero.,2025-07-30 11:53:26
384,8,Fantastic Steel Pants,Abbott - Parisian,tablet,Autem aptus terreo sordeo eos cicuta.,2025-02-04 22:57:47
385,7,Practical Concrete Hat,"Volkman, Mosciski and Ratke",box,Bardus thalassinus ter volutabrum textus ara contigo antiquus tracto omnis.,2025-01-24 03:45:11
386,6,Fresh Rubber Sausages,"Abbott, Schumm and Hamill",tablet,Saepe dolore crapula inflammatio aliquid statim.,2025-04-24 01:47:29
387,5,Unbranded Silk Ball,"Sporer, Kovacek and Runolfsdottir",bottle,Alii viscus arx artificiose voluptatum eveniet exercitationem.,2025-11-10 13:54:38
388,5,Generic Ceramic Shirt,"Hegmann, Wintheiser and Stiedemann",tablet,Bestia centum cur theatrum vulnus.,2025-08-06 04:23:05
389,2,Ergonomic Marble Shoes,Windler Group,vial,Eveniet varietas dolorum quae.,2025-09-18 18:12:44
390,3,Small Wooden Chicken,Frami - Feest,vial,Inventore claro curtus arbor cohibeo textor cultura.,2025-07-09 15:50:22
391,1,Fantastic Wooden Mouse,Denesik - Waters,tablet,Censura vacuus tubineus vinculum crur creber voluptatum crux decumbo.,2025-05-27 06:45:50
392,3,Handmade Rubber Car,McClure LLC,bottle,Repellat coerceo suasoria tergiversatio tam.,2025-04-02 13:16:01
393,9,,"Kuhn, Prohaska and Mitchell",certe,Vociferor aliquid civis desidero.,2025-10-29 17:12:14
394,7,Gorgeous Steel Salad,Breitenberg Inc,vial,Ambulo vicissitudo cornu.,2026-01-02 12:44:10
395,7,Refined Metal Computer,"Haag, Thompson and Olson",vial,Ulterius caries admitto aliqua.,2025-06-01 03:18:18
396,5,Awesome Gold Ball,"Strosin, Armstrong and Schulist",box,Venio velum modi circumvenio censura.,2025-12-22 03:24:40
397,3,Recycled Ceramic Table,"Schuppe, Tremblay and Armstrong",box,Caries decumbo defetiscor adversus centum.,2025-11-21 07:46:56
398,3,Modern Metal Hat,"Hickle, Muller and Yundt",vial,Vomito deserunt tenax trans alioqui adsuesco.,2025-04-10 01:41:01
399,10,Electronic Marble Sausages,Kuhlman - Metz,tablet,Aperiam carbo curo curriculum explicabo expedita nesciunt.,2025-03-14 16:14:12
400,3,Soft Concrete Bike,Prohaska LLC,tablet,Subvenio cupiditate voluptatem aer theatrum aegrotatio id absens.,2025-05-05 14:15:02
401,10,Bespoke Bamboo Keyboard,Bauch - Spencer,box,Xiphias decipio cubicularis careo unde inventore numquam tonsor tempore.,2025-04-07 01:05:18
402,3,Incredible Marble Ball,Gutmann LLC,tablet,Ambulo ventito vos argumentum abbas catena concedo uter adversus velociter.,2025-09-03 15:16:34
403,8,Handmade Wooden Pizza,"Bahringer, Corkery and Jacobs",tablet,Venio decipio admoveo pax taedium templum delectatio trucido.,2025-02-13 20:08:55
404,10,Frozen Bamboo Ball,Emmerich - Windler,bottle,Thesis cursim adiuvo ullus vir argumentum bellum torqueo theologus decor.,2025-04-14 12:34:35
405,8,Generic Concrete Towels,Bode - Lakin,box,Veritas defungo timidus ventito speciosus tero curriculum sufficio adnuo.,2025-03-07 12:42:49
406,10,Gorgeous Granite Sausages,"Swift, Stark and Pfeffer",bottle,Ducimus alienus clementia dignissimos cohaero nisi crepusculum sumo.,2025-12-19 06:50:49
407,8,Sleek Marble Towels,Swaniawski - Schulist,bottle,Adopto caecus tot amo cursus suspendo subito demo calco.,2025-11-26 22:40:19
408,4,Unbranded Concrete Keyboard,"Hessel, Nikolaus and Bauch",box,Totus subnecto vulpes decerno appositus voluptas stultus minima chirographum carbo.,2026-01-15 13:50:49
409,5,Luxurious Ceramic Bacon,"Padberg, Pacocha and Walter",tablet,Cenaculum ex claro turba terreo cubo anser.,2025-01-23 17:36:05
410,6,Electronic Plastic Sausages,Ruecker - Marvin,bottle,Alveus desolo creber spero solitudo quisquam truculenter defendo.,2025-11-06 20:55:56
411,3,Rustic Metal Bike,Dare LLC,box,Conspergo paens solutio desipio tenuis contigo dolorum voro temeritas tempora.,2025-06-09 09:14:54
412,2,Incredible Aluminum Soap,"Stanton, Doyle and Stracke",bottle,Magnam assumenda ubi veniam earum.,2025-01-29 23:27:47
413,6,Awesome Bronze Cheese,Johns - Stehr,vial,Apparatus sonitus tendo coma.,2025-04-30 11:38:22
414,5,Gorgeous Bamboo Car,Schowalter - Hartmann,vial,Cuius creo hic thesis ulterius aliqua sollers cupiditas deporto cibus.,2025-08-31 19:22:12
415,5,Luxurious Cotton Tuna,Thompson LLC,box,Amplus sonitus arcesso defetiscor comminor cuius sui stipes distinctio veritatis.,2025-02-03 07:54:37
416,3,Luxurious Silk Chips,Prohaska and Sons,tablet,Crepusculum demo accusamus victus crur collum.,2025-12-11 18:53:43
417,4,Frozen Aluminum Soap,"Sawayn, Halvorson and Tillman",vial,Aurum ipsam clarus catena benigne arguo assumenda debeo stips.,2025-06-05 08:39:18
